{
  "id": "feature-001",
  "category": "feature implementation",
  "description": "Feature acceptance test passes",
  "prompt": "Implement feature flag support in LingXiProtocol RuntimeCapabilities and ensure serializability.",
  "oracleKind": "testAssertion",
  "oracleScript": "oracle.sh",
  "maxSteps": 25,
  "timeoutSeconds": 300
}
